{
  "$schema": "https://json-schema.org/draft/2020-12/schema",
  "type": "object",
  "additionalProperties": false,
  "required": [
    "recordType",
    "schemaVersion",
    "id",
    "title",
    "status",
    "severity",
    "blocking",
    "linkedTaskIds",
    "symptoms",
    "workaround",
    "resolution",
    "relatedCommits",
    "createdAt",
    "updatedAt"
  ],
  "properties": {
    "recordType": {
      "const": "issue"
    },
    "schemaVersion": {
      "const": 1
    },
    "id": {
      "type": "string",
      "pattern": "^I-\\d{8}-[0-9A-HJKMNP-TV-Z]{4}$"
    },
    "title": {
      "type": "string",
      "minLength": 1,
      "maxLength": 200
    },
    "status": {
      "type": "string",
      "enum": [
        "open",
        "investigating",
        "blocked",
        "resolved"
      ]
    },
    "severity": {
      "type": "string",
      "enum": [
        "low",
        "medium",
        "high",
        "critical"
      ]
    },
    "owner": {
      "type": "string",
      "pattern": "^[A-Za-z0-9](?:[A-Za-z0-9-]{0,37}[A-Za-z0-9])?$",
      "minLength": 1,
      "maxLength": 39
    },
    "blocking": {
      "type": "boolean"
    },
    "linkedTaskIds": {
      "type": "array",
      "items": {
        "type": "string",
        "pattern": "^T-\\d{8}-[0-9A-HJKMNP-TV-Z]{4}$"
      },
      "uniqueItems": true
    },
    "symptoms": {
      "type": "array",
      "items": {
        "type": "string",
        "minLength": 1,
        "maxLength": 500
      }
    },
    "workaround": {
      "type": "string",
      "maxLength": 2000
    },
    "resolution": {
      "type": "string",
      "maxLength": 2000
    },
    "relatedCommits": {
      "type": "array",
      "items": {
        "type": "string",
        "pattern": "^[0-9a-f]{7,40}$"
      },
      "uniqueItems": true
    },
    "description": {
      "type": "string",
      "maxLength": 4000
    },
    "createdAt": {
      "type": "string",
      "format": "date-time"
    },
    "updatedAt": {
      "type": "string",
      "format": "date-time"
    }
  }
}
