{
  "blocking": true,
  "createdAt": "2026-07-29T15:21:31+08:00",
  "description": "已确认尺寸：小车 PCB 100×55 mm；503040 钥匙电池 42.35×30.54×4.92 mm；门锁电池组 68×55×19 mm；UWB 24×14 mm、总高上限 30 mm；4 位拨码 12.5×11.72×9.5 mm；1.77 英寸 ST7735S PCB 56×34 mm、可视区名义值 38.5×32 mm、孔距 52×30 mm、孔径 2.5 mm。v0.4 已为这些名义外廓生成可替换结构，但关键高度、孔位、执行杆和线束空间仍需实测后才能冻结装配版。",
  "id": "I-20260729-152X",
  "linkedTaskIds": [
    "T-20260729-E7RP"
  ],
  "owner": "37chengshan",
  "recordType": "issue",
  "relatedCommits": [],
  "resolution": "",
  "schemaVersion": 1,
  "severity": "medium",
  "status": "investigating",
  "symptoms": [
    "CR-3040D 与彩格 PETG 参数已确认并用于 v0.4：300×300×400 mm、0.4 mm 喷嘴、1.75 mm 耗材；材料范围喷嘴 235～270 ℃、热床 80～90 ℃、常规速度 40～100 mm/s",
    "当前完整 G-code 使用等待/首层/常规喷嘴 220/255/250 ℃、首层/常规热床 90/85 ℃；保持原三盘布局",
    "已为 13 种部件分别生成居中 G-code，共 22 个实例；13/13 文件通过温度、边界、对象数量和重叠校验，文件名标明 x1/x2/x3 数量",
    "13 种 STL、16 个标准实例已生成；24/24 CAD 回归和 13/13 STL 重载闭合检查通过，钥匙 105×58×33 mm、门锁 Ø276×100 mm 均在官方包络内",
    "0.25/0.35/0.45/0.55 mm 四档公差试片已由用户于 2026-07-30 实物打印，用户反馈打印效果非常完美；尚未记录四档中配合手感最佳的具体间隙",
    "仍缺 UWB Type-C 方向/突出高度/天线禁布区、100×55 mm PCB 孔位/最高器件、ST7735S 总厚度/排针/连接器方向",
    "仍缺钥匙 50×20 mm 候选控制板、启动按键、拨动开关执行杆、LED、蜂鸣器、电源板、线束和紧固件实测尺寸"
  ],
  "title": "C题3D结构仍缺关键接口与装配实测尺寸",
  "updatedAt": "2026-07-30T15:45:10+08:00",
  "workaround": "当前正式输出位于生成内容/3D打印/C题/v0.4/orcaslicer/。先使用 trial/ 中对应盘号的首层验证 G-code，确认床面清洁、调平、Z 偏置、首层连续且无喷嘴刮碰后，再运行 gcode/ 完整文件；建议先打印第 3 盘并试装钥匙控制面板、按键、拨动滑块、拨码和卡扣。不要使用旧聚合 3MF、旧 G-code，也不要在 Repetier-Host 中用旧 Slic3r 参数重切。最终冻结前必须记录公差最佳档位并补齐 UWB、PCB、显示器、钥匙控制板/开关、LED、蜂鸣器、线束和紧固件实测尺寸。"
}
